{
  "名字": "出差申请单",
  "槽位": {
    "目的地": {"说明": "出差去哪个城市", "类型": "文本", "提问": "请提供出差目的地。"},
    "日期":   {"说明": "出发日期", "类型": "文本", "提问": "请提供出差日期。"},
    "事由":   {"说明": "为什么出差", "类型": "文本", "提问": "请提供出差事由。"}
  },
  "阶段列表": [
    {
      "名字": "收集",
      "类型": "固定步骤",
      "目标": [
        {"谓词": "不为空", "槽位": "目的地"},
        {"谓词": "不为空", "槽位": "日期"},
        {"谓词": "不为空", "槽位": "事由"}
      ],
      "步骤": [
        {"说明": "问使用者去哪里", "工具": "ask", "参数": {"target": {"slot": "目的地", "path": []}, "hint": {}}},
        {"说明": "问使用者哪天出发", "工具": "ask", "参数": {"target": {"slot": "日期", "path": []}, "hint": {}}},
        {"说明": "问使用者出差事由", "工具": "ask", "参数": {"target": {"slot": "事由", "path": []}, "hint": {}}}
      ]
    }
  ],
  "交付物": [
    {"名字": "出差申请单", "说明": "填好的申请单", "来源": ["目的地", "日期", "事由"], "形态": "表单"}
  ]
}